INE886H01027, MEDIA & ENTERTAINMENT, Tv18 broadcast, TV18BRDCST
INE891D01026, SERVICES, Redington, REDINGTON
INE895B01021, TEXTILES, Rupa company, RUPA
INE901L01018, PHARMA, Alembic pharmaceuticals, APLLTD
INE913H01037, AUTOMOBILE, Endurance technologies, ENDURANCE
INE914M01019, HEALTHCARE SERVICES, Aster dm healthcare, ASTERDM
INE916U01025, CONSUMER GOODS, Sheela foam, SFL
INE917I01010, AUTOMOBILE, Bajaj auto, BAJAJ-AUTO
INE917M01012, CONSTRUCTION, Dilip buildcon, DBL
INE918I01018, FINANCIAL SERVICES, Bajaj finserv, BAJAJFINSV
INE930H01023, TEXTILES, Kpr mill, KPRMILL
INE931S01010, ENERGY, Adani transmission, ADANITRANS
INE933K01021, CONSUMER GOODS, Bajaj corp, BAJAJCORP
INE935A01035, PHARMA, Glenmark pharmaceuticals, GLENMARK
INE935N01012, CONSUMER GOODS, Dixon technologies, DIXON
INE942G01012, CONSUMER GOODS, Mcleod russel, MCLEODRUSS
INE944F01028, CONSUMER GOODS, Radico khaitan, RADICO
INE947J01015, MEDIA & ENTERTAINMENT, Den networks, DEN
INE947Q01010, PHARMA, Laurus labs, LAURUSLABS
INE949L01017, FINANCIAL SERVICES, Au small finance bank, AUBANK
INE950I01011, MEDIA & ENTERTAINMENT, Dbcorp, DBCORP
INE951I01027, INDUSTRIAL MANUFACTURING, V guard industries, VGUARD
INE956G01038, SERVICES, Va tech wabag, WABAG
INE974X01010, AUTOMOBILE, Tube investments, TIINDIA
INE975G01012, CONSTRUCTION, Il&fs transportation networks, IL&FSTRANS
INE976G01028, FINANCIAL SERVICES, Rbl bank, RBLBANK
INE978A01027, CONSUMER GOODS, Heritage foods, HERITGFOOD
INE982F01036, MEDIA & ENTERTAINMENT, Hathway cable datacom, HATHWAY
INE987B01026, PHARMA, Natco pharma, NATCOPHARM
INE988K01017, FINANCIAL SERVICES, Equitas holdings, EQUITAS
INE998I01010, SERVICES, Mahindra holidays resorts, MHRIL
